{
  "archetype": "service",
  "sector": "prof",
  "company": "成都启元财税服务有限公司",
  "co": "启元",
  "today": "2026-09-17",
  "period": "2026-08",
  "months": [
    "2025-09",
    "2025-10",
    "2025-11",
    "2025-12",
    "2026-01",
    "2026-02",
    "2026-03",
    "2026-04",
    "2026-05",
    "2026-06",
    "2026-07",
    "2026-08"
  ],
  "budgetYear": 2026,
  "profile": {
    "industry": "prof-accounting",
    "size": "21_50",
    "province": "四川",
    "city": "成都",
    "product": "代理记账、税务咨询与审计服务"
  },
  "sources": [
    {
      "id": "m6",
      "name": "AI CFO · 账套三表与现金",
      "mode": "direct",
      "lastSync": "2026-09-17 07:30",
      "rows": 12
    },
    {
      "id": "m10",
      "name": "AI ERP · 服务交付与工单",
      "mode": "direct",
      "lastSync": "2026-09-17 07:30",
      "rows": 15
    },
    {
      "id": "m4",
      "name": "AI获客 · 线索与成交",
      "mode": "direct",
      "lastSync": "2026-09-17 07:30",
      "rows": 21
    },
    {
      "id": "m5",
      "name": "AI人力官 · 花名册与合规",
      "mode": "direct",
      "lastSync": "2026-09-17 07:30",
      "rows": 46
    },
    {
      "id": "m7",
      "name": "AI法务 · 合同与台账",
      "mode": "direct",
      "lastSync": "2026-09-17 07:30",
      "rows": 8
    }
  ],
  "series": {
    "rev": [
      1260000,
      1310000,
      1290000,
      1420000,
      1680000,
      1120000,
      1380000,
      1460000,
      1510000,
      1440000,
      1390000,
      1360000
    ],
    "cogs": [
      680400,
      704780,
      699180,
      773900,
      890400,
      649600,
      756240,
      795700,
      828990,
      797760,
      778400,
      767040
    ],
    "material": [
      216276,
      240656,
      235056,
      309776,
      426276,
      185476,
      292116,
      331576,
      364866,
      333636,
      314276,
      302916
    ],
    "prodLabor": [
      456924,
      456924,
      456924,
      456924,
      456924,
      456924,
      456924,
      456924,
      456924,
      456924,
      456924,
      456924
    ],
    "labor": [
      356401,
      356401,
      356401,
      356401,
      356401,
      356401,
      356401,
      356401,
      356401,
      356401,
      356401,
      356401
    ],
    "overhead": [
      107723,
      107723,
      107723,
      107723,
      107723,
      107723,
      107723,
      107723,
      107723,
      107723,
      107723,
      107723
    ],
    "sellExp": [
      93600,
      96600,
      95400,
      103200,
      118800,
      85200,
      100800,
      105600,
      108600,
      104400,
      101400,
      99600
    ],
    "adminExp": [
      227468,
      229530,
      229193,
      234648,
      242252,
      221308,
      232892,
      236274,
      238582,
      236540,
      234928,
      262332
    ],
    "rdExp": [
      0,
      0,
      0,
      0,
      0,
      0,
      0,
      0,
      0,
      0,
      0,
      0
    ],
    "finExp": [
      5283,
      5283,
      5283,
      5283,
      5283,
      5283,
      5283,
      5283,
      5283,
      5283,
      5283,
      -717
    ],
    "orders": [
      1080,
      1090,
      1100,
      1120,
      1140,
      1130,
      1140,
      1150,
      1160,
      1170,
      1170,
      1180
    ],
    "ar": [
      1880000,
      1920000,
      1960000,
      2010000,
      2060000,
      1980000,
      2020000,
      2080000,
      2120000,
      2160000,
      2210000,
      2298000
    ],
    "inventory": [
      0,
      0,
      0,
      0,
      0,
      0,
      0,
      0,
      0,
      0,
      0,
      0
    ],
    "ap": [
      214000,
      220000,
      226000,
      230000,
      236000,
      228000,
      232000,
      238000,
      242000,
      246000,
      250000,
      254000
    ],
    "purchases": [
      216276,
      240656,
      235056,
      309776,
      426276,
      185476,
      292116,
      331576,
      364866,
      333636,
      314276,
      302916
    ],
    "cash": [
      1237104,
      1418467,
      1579200,
      1777444,
      2092187,
      2199268,
      2421563,
      2618732,
      2835424,
      3013184,
      3163850,
      3245725
    ],
    "arOverdue": [
      246000,
      255840,
      262400,
      268960,
      275520,
      282080,
      288640,
      295200,
      305040,
      314880,
      321440,
      328000
    ],
    "onTimeRate": [
      0.842,
      0.842,
      0.835,
      0.827,
      0.819,
      0.827,
      0.819,
      0.811,
      0.803,
      0.796,
      0.788,
      0.78
    ],
    "lateOrders": [
      3,
      3,
      4,
      5,
      8,
      2,
      4,
      6,
      5,
      4,
      5,
      2
    ],
    "load": [
      0.8,
      0.8,
      0.82,
      0.86,
      0.94,
      0.72,
      0.84,
      0.9,
      0.9,
      0.88,
      0.9,
      0.92
    ],
    "leads": [
      6,
      7,
      7,
      8,
      9,
      5,
      7,
      8,
      8,
      8,
      8,
      5
    ],
    "deals": [
      0,
      1,
      2,
      1,
      2,
      2,
      2,
      2,
      2,
      2,
      2,
      2
    ],
    "winRate": [
      0.263,
      0.266,
      0.269,
      0.272,
      0.275,
      0.275,
      0.277,
      0.28,
      0.283,
      0.286,
      0.286,
      0.286
    ],
    "headcount": [
      41,
      42,
      42,
      43,
      44,
      44,
      45,
      45,
      46,
      46,
      46,
      46
    ],
    "turnover": [
      0.206,
      0.211,
      0.211,
      0.216,
      0.221,
      0.221,
      0.226,
      0.23,
      0.235,
      0.235,
      0.24,
      0.24
    ],
    "overtimeOver": [
      4,
      4,
      5,
      6,
      12,
      2,
      5,
      8,
      8,
      7,
      8,
      9
    ],
    "complianceExposure": [
      991538,
      1015722,
      1027814,
      1051998,
      1064090,
      1088274,
      1112458,
      1136641,
      1160825,
      1185009,
      1197101,
      1209193
    ],
    "highRiskContracts": [
      0,
      0,
      0,
      0,
      0,
      0,
      0,
      0,
      0,
      0,
      0,
      0
    ]
  },
  "budget": {
    "rev": [
      1300000,
      1320000,
      1340000,
      1400000,
      1600000,
      1200000,
      1400000,
      1450000,
      1500000,
      1480000,
      1450000,
      1450000
    ],
    "gm": 0.46,
    "opex": 480000,
    "onTimeRate": 0.97,
    "ccc": 45,
    "deals": 3,
    "turnover": 0.2
  },
  "facts": {
    "revMonth": 1360000,
    "cogsMonth": 767040,
    "cash": 3163850,
    "loanBalance": 500000,
    "socialDeltaMonth": 45968,
    "socialExposure": 551613,
    "socialExposureText": "55.2 万元",
    "contractExposure": 0,
    "arOverdue": "32.8 万元",
    "lateOrders": 2,
    "onTimeRate": 78,
    "lateDaysTotal": 3,
    "load": 92,
    "dealsMonth": 2,
    "leadsMonth": 5,
    "ordersMonth": 1180,
    "leadOverdue": 2,
    "leadUnassigned": 9,
    "leavers12": 11,
    "leaveReasons": "薪酬与其他",
    "socialBaseRatio": 66,
    "highRiskContracts": 0,
    "worstContract": "—",
    "rdStaff": 0,
    "cncOvertime": 9,
    "cncNeed": "R-2609-01",
    "cncNeedCount": 3,
    "needJob": "代账会计",
    "steelName": "外购数据与软件工具",
    "materialPriceDelta": "+6.0%",
    "frameworkContract": "HT-2603-172",
    "urgentPurchaseNote": "申报期临时增购工具账号 8 个",
    "overheadNote": "办公场地租金随高新分公司筹备增加",
    "orderMixNote": "小微客户占 72%，上月 70%",
    "k017Contract": "HT-2609-211",
    "k017Name": "K-211 · 园区科技企业",
    "k017TermDays": 60,
    "priceReviewDate": "12-31",
    "k017Overdue": "21 万元",
    "sellExpNote": "园区活动与渠道返点较上月增加",
    "adminExpNote": "管理费用含一次性分公司筹备开支 1.8 万元",
    "finExpNote": "无借款，利息收入冲减",
    "inventoryNote": "服务业无存货",
    "inventoryDiffNote": "无",
    "apNote": "应付 25 万元，主要为工具订阅",
    "oneOff": {
      "adminExp": 18000
    },
    "bottleneck": "申报期作业",
    "lossName": "工具与外购成本压降",
    "lossNote": "外购数据与工具订阅按用量采购，人均工具成本下降"
  },
  "decisions": [
    {
      "id": "D-2605-01",
      "title": "代账流水线分班组作业",
      "cause": "onTimeRate",
      "option": "流水线作业",
      "owner": "生产负责人",
      "approvedAt": "2026-05-12",
      "status": "done",
      "invest": 30000,
      "expected": "申报期按期完成率 97% 以上",
      "milestones": [
        {
          "title": "四个班组与节点定义",
          "due": "2026-06-01",
          "status": "done"
        },
        {
          "title": "系统流转上线",
          "due": "2026-06-20",
          "status": "done"
        },
        {
          "title": "复盘：按期完成率",
          "due": "2026-08-15",
          "status": "done"
        }
      ],
      "tracking": {
        "metric": "onTimeRate",
        "months": [
          "2026-06",
          "2026-07",
          "2026-08"
        ],
        "target": [
          0.95,
          0.97,
          0.97
        ],
        "actual": [
          0.94,
          0.93,
          0.92
        ]
      },
      "review": {
        "result": "miss",
        "text": "流水线让节点清楚了，但人均 50 户以上、申报期加班超限，按期率仍下滑；下一步补代账会计并做高新分公司分流",
        "reviewedAt": "2026-08-15"
      }
    },
    {
      "id": "D-2607-02",
      "title": "高新分公司设立",
      "cause": "orders",
      "option": "就近服务园区客户",
      "owner": "总经理",
      "approvedAt": "2026-07-25",
      "status": "executing",
      "invest": 300000,
      "expected": "园区客户续费率提升，新客每月 +2",
      "milestones": [
        {
          "title": "设立方案确认（AI法务）",
          "due": "2026-09-30",
          "status": "doing"
        },
        {
          "title": "分公司登记",
          "due": "2026-10-30",
          "status": "todo"
        },
        {
          "title": "代账会计到岗（AI人力官）",
          "due": "2026-10-25",
          "status": "todo"
        }
      ],
      "tracking": null,
      "review": null
    }
  ],
  "approvals": [],
  "log": []
}
