{
  "archetype": "flow",
  "sector": "trade",
  "company": "义乌恒益日用品有限公司",
  "co": "恒益",
  "today": "2026-09-17",
  "period": "2026-08",
  "months": [
    "2025-09",
    "2025-10",
    "2025-11",
    "2025-12",
    "2026-01",
    "2026-02",
    "2026-03",
    "2026-04",
    "2026-05",
    "2026-06",
    "2026-07",
    "2026-08"
  ],
  "budgetYear": 2026,
  "profile": {
    "industry": "trade-wholesale",
    "size": "51_100",
    "province": "浙江",
    "city": "义乌",
    "product": "日用百货与进口日化的批发与电商零售"
  },
  "sources": [
    {
      "id": "m6",
      "name": "AI CFO · 账套三表与现金",
      "mode": "direct",
      "lastSync": "2026-09-17 07:30",
      "rows": 12
    },
    {
      "id": "m10",
      "name": "AI ERP · 订单履约与库存",
      "mode": "direct",
      "lastSync": "2026-09-17 07:30",
      "rows": 15
    },
    {
      "id": "m4",
      "name": "AI获客 · 线索与成交",
      "mode": "direct",
      "lastSync": "2026-09-17 07:30",
      "rows": 31
    },
    {
      "id": "m5",
      "name": "AI人力官 · 花名册与合规",
      "mode": "direct",
      "lastSync": "2026-09-17 07:30",
      "rows": 62
    },
    {
      "id": "m7",
      "name": "AI法务 · 合同与台账",
      "mode": "direct",
      "lastSync": "2026-09-17 07:30",
      "rows": 8
    }
  ],
  "series": {
    "rev": [
      3120000,
      3480000,
      3960000,
      4210000,
      3860000,
      2240000,
      3060000,
      3280000,
      3410000,
      3520000,
      3390000,
      3260000
    ],
    "cogs": [
      2539680,
      2839680,
      3243240,
      3456410,
      3180640,
      1854720,
      2515320,
      2706000,
      2820070,
      2918080,
      2820480,
      2722100
    ],
    "material": [
      2279359,
      2629359,
      3012919,
      2976089,
      2660319,
      1404399,
      2274999,
      2485679,
      2609749,
      2687759,
      2570159,
      2491779
    ],
    "prodLabor": [
      349521,
      349521,
      349521,
      349521,
      349521,
      349521,
      349521,
      349521,
      349521,
      349521,
      349521,
      349521
    ],
    "labor": [
      174761,
      174761,
      174761,
      174761,
      174761,
      174761,
      174761,
      174761,
      174761,
      174761,
      174761,
      174761
    ],
    "overhead": [
      85560,
      35560,
      55560,
      305560,
      345560,
      275560,
      65560,
      45560,
      35560,
      55560,
      75560,
      55560
    ],
    "sellExp": [
      177760,
      195040,
      218080,
      230080,
      213280,
      135520,
      174880,
      185440,
      191680,
      196960,
      190720,
      184480
    ],
    "adminExp": [
      252515,
      260771,
      272135,
      279615,
      267283,
      232243,
      253703,
      259483,
      263379,
      267251,
      264965,
      295279
    ],
    "rdExp": [
      0,
      0,
      0,
      0,
      0,
      0,
      0,
      0,
      0,
      0,
      0,
      0
    ],
    "finExp": [
      9450,
      9450,
      9450,
      9450,
      9450,
      9450,
      9450,
      9450,
      9450,
      9450,
      9450,
      -8550
    ],
    "orders": [
      1180,
      1320,
      1510,
      1620,
      1470,
      860,
      1160,
      1250,
      1300,
      1350,
      1290,
      1240
    ],
    "ar": [
      5180000,
      5360000,
      5620000,
      5740000,
      5580000,
      5060000,
      5180000,
      5320000,
      5410000,
      5520000,
      5580000,
      5736000
    ],
    "inventory": [
      6320000,
      6480000,
      6620000,
      6510000,
      6360000,
      6280000,
      6410000,
      6560000,
      6720000,
      6860000,
      6980000,
      7120000
    ],
    "ap": [
      3920000,
      4080000,
      4260000,
      4180000,
      3940000,
      3620000,
      3810000,
      3960000,
      4040000,
      4120000,
      4180000,
      4220000
    ],
    "purchases": [
      2279359,
      2629359,
      3012919,
      2976089,
      2660319,
      1404399,
      2274999,
      2485679,
      2609749,
      2687759,
      2570159,
      2491779
    ],
    "cash": [
      1661194,
      1634364,
      1610572,
      1746210,
      1949552,
      2151581,
      2204210,
      1790617,
      1728142,
      1669859,
      1630727,
      1419357
    ],
    "arOverdue": [
      707000,
      727200,
      757500,
      808000,
      828200,
      858500,
      868600,
      888800,
      929200,
      959500,
      979700,
      1010000
    ],
    "onTimeRate": [
      0.874,
      0.866,
      0.858,
      0.842,
      0.842,
      0.858,
      0.835,
      0.827,
      0.819,
      0.811,
      0.796,
      0.78
    ],
    "lateOrders": [
      2,
      2,
      3,
      4,
      3,
      1,
      2,
      3,
      3,
      3,
      3,
      2
    ],
    "load": [
      0.7,
      0.74,
      0.8,
      0.86,
      0.8,
      0.5,
      0.7,
      0.74,
      0.76,
      0.8,
      0.82,
      0.84
    ],
    "leads": [
      9,
      10,
      12,
      14,
      12,
      6,
      9,
      10,
      11,
      12,
      11,
      7
    ],
    "deals": [
      0,
      2,
      1,
      1,
      2,
      2,
      2,
      1,
      2,
      2,
      2,
      3
    ],
    "winRate": [
      0.175,
      0.178,
      0.182,
      0.184,
      0.184,
      0.186,
      0.188,
      0.19,
      0.192,
      0.194,
      0.194,
      0.194
    ],
    "headcount": [
      56,
      57,
      58,
      60,
      61,
      60,
      60,
      61,
      62,
      62,
      62,
      62
    ],
    "turnover": [
      0.234,
      0.234,
      0.239,
      0.239,
      0.244,
      0.244,
      0.25,
      0.25,
      0.255,
      0.255,
      0.26,
      0.26
    ],
    "overtimeOver": [
      2,
      3,
      5,
      8,
      6,
      1,
      2,
      3,
      3,
      4,
      5,
      6
    ],
    "complianceExposure": [
      837287,
      858219,
      879152,
      900084,
      921016,
      941948,
      962880,
      983812,
      1004745,
      1025677,
      1036143,
      1046609
    ],
    "highRiskContracts": [
      0,
      0,
      1,
      1,
      1,
      1,
      1,
      1,
      1,
      1,
      1,
      1
    ]
  },
  "budget": {
    "rev": [
      3200000,
      3500000,
      3900000,
      4200000,
      3800000,
      2500000,
      3200000,
      3400000,
      3500000,
      3600000,
      3500000,
      3500000
    ],
    "gm": 0.19,
    "opex": 380000,
    "onTimeRate": 0.95,
    "ccc": 60,
    "deals": 3,
    "turnover": 0.22
  },
  "facts": {
    "revMonth": 3260000,
    "cogsMonth": 2722100,
    "cash": 1630727,
    "loanBalance": 1500000,
    "socialDeltaMonth": 42484,
    "socialExposure": 509810,
    "socialExposureText": "51 万元",
    "contractExposure": 280000,
    "arOverdue": "101 万元",
    "lateOrders": 2,
    "onTimeRate": 78,
    "lateDaysTotal": 4,
    "load": 84,
    "dealsMonth": 3,
    "leadsMonth": 7,
    "ordersMonth": 1240,
    "leadOverdue": 2,
    "leadUnassigned": 14,
    "leavers12": 16,
    "leaveReasons": "家庭 / 异地与其他",
    "socialBaseRatio": 62,
    "highRiskContracts": 1,
    "worstContract": "HT-2609-102 40 分",
    "rdStaff": 0,
    "cncOvertime": 6,
    "cncNeed": "R-2609-01",
    "cncNeedCount": 2,
    "needJob": "电商运营",
    "steelName": "进口日化与纸品",
    "materialPriceDelta": "+4.6%",
    "frameworkContract": "HT-2606-088",
    "urgentPurchaseNote": "本月临时补货 5 笔，均价高于协议价 5%",
    "overheadNote": "仓储租金与配送车辆折旧随中心仓扩容上升",
    "orderMixNote": "社区团购小单占 46%，上月 40%",
    "k017Contract": "HT-2609-102",
    "k017Name": "K-102 · 连锁便利店总部",
    "k017TermDays": 90,
    "priceReviewDate": "11-30",
    "k017Overdue": "58 万元",
    "sellExpNote": "平台推广投放较上月增加 12%",
    "adminExpNote": "管理费用含一次性新平台开店服务费 2 万元",
    "finExpNote": "短贷 150 万元按月计息",
    "inventoryNote": "存货 712 万元，进口日化占 41%",
    "inventoryDiffNote": "账面存货与 WMS 差异 2.4 万元",
    "apNote": "应付 422 万元，账期 45 天",
    "oneOff": {
      "adminExp": 20000
    },
    "bottleneck": "分拣打包",
    "lossName": "破损与退货损耗压降",
    "lossNote": "包装与配送破损率从 1.8% 降到 1.2%，退货折价处置规范化"
  },
  "decisions": [
    {
      "id": "D-2605-01",
      "title": "中心仓扩容 1,000 ㎡",
      "cause": "onTimeRate",
      "option": "仓储扩容",
      "owner": "生产负责人",
      "approvedAt": "2026-05-08",
      "status": "done",
      "invest": 180000,
      "expected": "大促期间次日达率不低于 95%",
      "milestones": [
        {
          "title": "租赁与改造",
          "due": "2026-06-15",
          "status": "done"
        },
        {
          "title": "货架与 WMS 上线",
          "due": "2026-06-30",
          "status": "done"
        },
        {
          "title": "复盘：次日达率",
          "due": "2026-08-15",
          "status": "done"
        }
      ],
      "tracking": {
        "metric": "onTimeRate",
        "months": [
          "2026-06",
          "2026-07",
          "2026-08"
        ],
        "target": [
          0.93,
          0.95,
          0.95
        ],
        "actual": [
          0.9,
          0.88,
          0.86
        ]
      },
      "review": {
        "result": "miss",
        "text": "仓容不再是瓶颈，分拣打包人手成为新瓶颈，大促期加班超限；下一步补分拣人手并调整排班",
        "reviewedAt": "2026-08-15"
      }
    },
    {
      "id": "D-2607-02",
      "title": "华南分公司设立",
      "cause": "orders",
      "option": "华南就近配送",
      "owner": "总经理",
      "approvedAt": "2026-07-22",
      "status": "executing",
      "invest": 600000,
      "expected": "华南门店配送时效缩短 2 天",
      "milestones": [
        {
          "title": "设立方案确认（AI法务）",
          "due": "2026-09-30",
          "status": "doing"
        },
        {
          "title": "分公司登记",
          "due": "2026-10-25",
          "status": "todo"
        },
        {
          "title": "配送员到岗（AI人力官）",
          "due": "2026-10-10",
          "status": "todo"
        }
      ],
      "tracking": null,
      "review": null
    }
  ],
  "approvals": [],
  "log": []
}
